{
  "schema": "harness-skill-contract@1",
  "skill": "customer-agent-context-audit",
  "version": "1.0.0",
  "mode": "read_only",
  "inputs": ["finding-set@1"],
  "capabilities": ["workspace.read"],
  "outputs": ["context-enriched-finding-set@1"],
  "extension_type": "finding-enricher",
  "extension_points": {}
}
