{
  "schema": "harness-skill-contract@1",
  "skill": "customer-agent-module-audit",
  "version": "1.0.0",
  "mode": "read_only",
  "inputs": ["module-scope@1"],
  "capabilities": ["workspace.read"],
  "outputs": ["finding-set@1"],
  "extension_type": "procedure",
  "extension_points": {
    "before-analysis": ["context-provider", "audit-lens"],
    "finding-enrichment": ["finding-enricher"],
    "before-validation": ["gate", "audit-lens"]
  }
}
