{
  "schema": "harness-skill-contract@1",
  "skill": "customer-agent-adversarial-review",
  "version": "1.0.0",
  "mode": "read_only",
  "inputs": ["patch-set@1"],
  "capabilities": ["workspace.read", "vcs.diff.read"],
  "outputs": ["review-finding-set@1"],
  "extension_type": "audit-lens",
  "extension_points": {
    "finding-enrichment": ["finding-enricher"],
    "before-validation": ["gate", "audit-lens"]
  }
}
